{
  "page": 1,
  "results": [
    {
      "id": 603,
      "title": "The Matrix",
      "original_title": "The Matrix",
      "overview": null,
      "tagline": null,
      "release_date": null,
      "runtime": null,
      "genres": [],
      "production_companies": [],
      "production_countries": [],
      "spoken_languages": [],
      "poster_path": null,
      "backdrop_path": null,
      "vote_average": 8.2,
      "vote_count": 25000,
      "popularity": null,
      "status": null,
      "homepage": null,
      "external_ids": {},
      "budget": null,
      "revenue": null,
      "videos": [],
      "images": [],
      "recommendations": [],
      "similar": []
    },
    {
      "id": 1399,
      "name": "Game of Thrones",
      "original_name": "Game of Thrones",
      "overview": null,
      "tagline": null,
      "first_air_date": null,
      "last_air_date": null,
      "episode_run_time": [],
      "number_of_seasons": 8,
      "number_of_episodes": 73,
      "genres": [],
      "networks": [],
      "production_companies": [],
      "origin_country": [],
      "poster_path": null,
      "backdrop_path": null,
      "vote_average": 8.4,
      "vote_count": 21000,
      "popularity": null,
      "homepage": null,
      "external_ids": {},
      "seasons": [],
      "videos": [],
      "images": [],
      "recommendations": [],
      "similar": []
    }
  ],
  "total_pages": 500,
  "total_results": 10000
}
